timestamp,content,title,author,board
2024-01-15 14:30:00,"今天和朋友聊天很開心，分享了很多有趣的事情。","和朋友聊天的美好時光","girl123",WomenTalk
2024-01-15 15:15:00,"這個化妝品讓我感到很滿意，效果比預期的還要好。","滿意的化妝品","girl456",WomenTalk
2024-01-15 16:00:00,"看到這個穿搭建議我很興奮，明天就試試看！","令人興奮的穿搭","girl789",WomenTalk
2024-01-15 17:45:00,"這個護膚心得很有用，我的皮膚狀況改善很多。","有用的護膚心得","girl101",WomenTalk
2024-01-15 18:20:00,"今天工作很累，心情有點低落。","心情低落的一天","girl202",WomenTalk
2024-01-16 10:10:00,"這個餐廳的評價讓我感到很期待，週末要去試試。","令人期待的餐廳","girl303",WomenTalk
2024-01-16 11:30:00,"這個感情問題讓我感到很困惑，不知道該怎麼處理。","令人困惑的感情","girl404",WomenTalk
2024-01-16 12:00:00,"這個減肥方法很有效，我已經瘦了3公斤了！","有效的減肥方法","girl505",WomenTalk
2024-01-16 13:15:00,"這個職場經驗分享很有啟發性，學到很多。","有啟發性的分享","girl606",WomenTalk
2024-01-16 14:30:00,"今天買到喜歡的衣服，心情特別好！","買到喜歡的衣服","girl707",WomenTalk
2024-01-17 09:00:00,"這個美妝教學很實用，化妝技巧進步很多。","實用的美妝教學","girl808",WomenTalk
2024-01-17 10:15:00,"這個健康資訊很重要，大家都要注意身體。","重要的健康資訊","girl909",WomenTalk
2024-01-17 11:00:00,"今天和家人相處很愉快，感受到滿滿的愛。","愉快的家庭時光","girl010",WomenTalk
2024-01-17 12:30:00,"這個理財建議很專業，對我的財務規劃很有幫助。","專業的理財建議","girl111",WomenTalk
2024-01-17 13:45:00,"這個旅行計畫讓我感到很興奮，已經開始期待了！","令人興奮的旅行","girl212",WomenTalk 